{
  "$schema": "https://json-schema.org/draft/2020-12/schema",
  "title": "音效注册表",
  "type": "array",
  "items": {
    "type": "object",
    "required": ["id", "name", "file"],
    "properties": {
      "id": { "$ref": "#/$defs/id" },
      "name": { "type": "string", "minLength": 1 },
      "file": { "type": "string", "minLength": 1 },
      "volume": { "type": "number", "minimum": 0, "maximum": 1 },
      "description": { "type": "string" }
    },
    "additionalProperties": false
  },
  "$defs": {
    "id": { "type": "string", "pattern": "^[A-Za-z][A-Za-z0-9_-]*$" }
  }
}
